status;post_user_90229869376;90229869376_10154676285204377;https://www.facebook.com/90229869376/posts/10154676285204377;I was shopping in the Pontllanfraith branch a while ago around the egg section i was looking at which to buy  I actually heard ticking around the area  my husband went to find someone to report it to and eventually went to customer service to report the ticking.He was told it was the security device on a reduced set of saucepans  and it had been reported to them the day before.In this day and age with all the security issues  should they have not been removed ........it gave me a scare . just saying  !;;;;;2016-03-24T12:43:40+0000;1458823420;2016-03-24 13:43:40;1;2;1;0;3;2;1;1;0;0;1;0;0;0;0;0;0
status;post_user_90229869376;90229869376_10154676281774377;https://www.facebook.com/90229869376/posts/10154676281774377;On Monday morning  in the main store in Swansea  the fire alarm went off. It was not a fire drill. The way in which the staff evacuated the store was dreadful. The attitude of the staff I watched was very casual. There were several elderly people who needed help  but weren t given any! The fire engine took about 20 minutes to arrive  with no siren and no flashing blue lights. Sainsbury s in Swansea needs to review its fire drill procedure big time.;;;;;2016-03-24T12:42:19+0000;1458823339;2016-03-24 13:42:19;0;4;0;0;4;4;2;2;0;0;0;0;0;0;0;0;0
status;post_user_90229869376;90229869376_10154676013579377;https://www.facebook.com/90229869376/posts/10154676013579377;Sainsbury s Reed diffusers  have these changed as I seem unable to find ones I had bought from here previously  the ones instore now seem more diluted.;;;;;2016-03-24T11:13:37+0000;1458818017;2016-03-24 12:13:37;0;6;0;0;6;6;4;2;1;0;0;0;0;0;0;0;0
status;post_user_90229869376;90229869376_10154675979059377;https://www.facebook.com/90229869376/posts/10154675979059377;Hi  I had an email saying that if I bought carnation that I could enter to win bonus Nectar points but I can t figure out how it works. I bought some last night but there seems to be no way to enter;;;;;2016-03-24T11:00:45+0000;1458817245;2016-03-24 12:00:45;0;7;0;0;7;7;1;6;1;0;0;0;0;0;0;0;0
status;post_user_90229869376;90229869376_10154675949054377;https://www.facebook.com/90229869376/posts/10154675949054377;Have ordered some Lamb with our delivery from you to come tommorow  Can you tell me if its pre-stunned slaughter or Halal  and likely country of origin please?;;;;;2016-03-24T10:46:12+0000;1458816372;2016-03-24 11:46:12;2;8;2;0;10;8;3;5;1;0;2;0;0;0;0;0;0
status;post_user_90229869376;90229869376_10154675693764377;https://www.facebook.com/90229869376/posts/10154675693764377;Do sainsbury (main store)  price match on wine?   I am going to store later this evening but a wine I want for the weekend is cheaper in asda.;;;;;2016-03-24T09:26:25+0000;1458811585;2016-03-24 10:26:25;0;1;0;0;1;1;1;0;0;0;0;0;0;0;0;0;0
status;post_user_90229869376;90229869376_10154675693344377;https://www.facebook.com/90229869376/posts/10154675693344377;I have had two strokes wich has left me with cognitive issues that can be demanding and frustrating for both parties when placing my orders online. On occasion s I get confused and will need to contact the Sainsbury s customer care line or the local store that is taking my order so to correct my mistakes or my confushion. Each time I have contacted the customer care team or the store they have treated me with the utmost respect   consideration  and understanding .The independence that Sainsbury s provides me is immeasurable .Thank you so much;;;;;2016-03-24T09:26:13+0000;1458811573;2016-03-24 10:26:13;1;3;1;0;4;3;2;1;0;0;1;0;0;0;0;0;0
status;post_user_90229869376;90229869376_10154673496589377;https://www.facebook.com/90229869376/posts/10154673496589377;This week we were delivered a 2 litre bottle of Pepsi max that is 7 months out of date  I actually complained to Pepsi initially because of it tasting off  before realising the bbd. How do I go about getting you to collect the item and acknowledge the error?;;;;;2016-03-23T21:44:45+0000;1458769485;2016-03-23 22:44:45;0;4;0;0;4
status;post_user_90229869376;90229869376_10154673367444377;https://www.facebook.com/90229869376/posts/10154673367444377;I am absolutely disgusted with the service received from Sainsburys this eve. Booked a Delivery to arrive between 6.30-7.30pm this eve and have just called to say that my address couldn t be find! Even though I have had deliveries before!! And not even a phone call to inform us or ask for directions!! I will never again be trusting Sainsburys to deliver my shopping!! Stunned to be honest! 😡;;;;;2016-03-23T21:10:59+0000;1458767459;2016-03-23 22:10:59;4;3;4;0;7;3;1;2;0;0;4;0;0;0;0;0;0
status;post_user_90229869376;90229869376_10154673331079377;https://www.facebook.com/90229869376/posts/10154673331079377;Wondering if you could answer a store specific question. I would like to buy a sweet pastry case (premade) and wanted to be sure you have them in store at Aberdeen berryden Ab25. Cheers.;;;;;2016-03-23T20:58:55+0000;1458766735;2016-03-23 21:58:55;0;3;0;0;3;3;1;2;1;0;0;0;0;0;0;0;0
status;post_user_90229869376;90229869376_10154673286014377;https://www.facebook.com/90229869376/posts/10154673286014377;I thought Sainsbury s had decided it is not PC to use the word Easter? Well until you start selling Easter (not chocolate) eggs again  we will be purchasing ours from your rivals  & be encouraging all our friends & family to do the same.;;;;;2016-03-23T20:51:32+0000;1458766292;2016-03-23 21:51:32;2;6;2;1;9;6;4;2;2;0;2;0;0;0;0;0;0
status;post_user_90229869376;90229869376_10154673180974377;https://www.facebook.com/90229869376/posts/10154673180974377;Is your mobile site not working properly ?  Only click n collect available as an option ?;;;;;2016-03-23T20:24:36+0000;1458764676;2016-03-23 21:24:36;0;1;0;0;1;1;1;0;0;0;0;0;0;0;0;0;0
status;post_user_90229869376;90229869376_10154673126854377;https://www.facebook.com/90229869376/posts/10154673126854377;I have just been into your store in Coventry Fletchamstead Highway and purchased some shopping  when asked if I had my Nectar card I passed the lady on the till my iphone with the Nectar app barcode to be scanned  she refused to do this and said that they had been informed not to scan apps anymore  I have been using this app for months and months in this store and never been refused before  the same app Stocard has my Tesco club card  Costa card  Nandos card and many more all of which have been scanned with no issue anywhere. I asked to see a manager and she informed me that they cannot scan customer phones as the scanner might affect the phone. I find this very strange as a bar code scanner is just a beam of infrared light that cannot cause any harm at all. Please can someone confirm Sainsburys official stance on this please. Thanks Andrew;;;;;2016-03-23T20:12:34+0000;1458763954;2016-03-23 21:12:34;1;42;1;1;44;42;9;33;18;0;1;0;0;0;0;0;0
status;post_user_90229869376;90229869376_10154673010069377;https://www.facebook.com/90229869376/posts/10154673010069377;Hi please can you tell me if you plan to stock anymore blue short sleeved  non iron school shirts? Bought lots over the past few years  but not any in store in Wednesfield or Wolverhampton. thanks;;;;;2016-03-23T19:44:42+0000;1458762282;2016-03-23 20:44:42;0;3;0;0;3;3;1;2;1;0;0;0;0;0;0;0;0
status;post_user_90229869376;90229869376_10154672901599377;https://www.facebook.com/90229869376/posts/10154672901599377;Good evening! I m really dissatisfied with Sainsburys! I normally buy the 10 pack fridge pack of Stella Artois every 4 days. I went to your store in Arnos Grove this evening and was charged £8 as usual. However  when I got home  I realised the pack contained 330ml cans instead of the 440ml which I am used to buying. Tesco and Asda are doing the 440ml pack for £8! Basically  I ve lost out on 1.1l of Stella. I m not happy and needless to say  I won t be using your stores again. I feel the  deception  (for want of a better word) is abysmal. Best regards Jim;;;;;2016-03-23T19:15:25+0000;1458760525;2016-03-23 20:15:25;2;10;2;0;12;10;2;8;1;0;2;0;0;0;0;0;0
status;post_user_90229869376;90229869376_10154672890584377;https://www.facebook.com/90229869376/posts/10154672890584377;Found out today that all the unused  SCHOOL VOUCHERS  go straight in the bin. WHY????;;;;;2016-03-23T19:10:14+0000;1458760214;2016-03-23 20:10:14;0;10;0;0;10;10;3;7;2;0;0;0;0;0;0;0;0
status;post_user_90229869376;90229869376_10154672728579377;https://www.facebook.com/90229869376/posts/10154672728579377;Called into your Scunthorpe store today to pick up some bits for tea and just wanted to say how impressed I was with the huge range of free from products that were available. My baby is milk and wheat intolerant and often has to watch his older brother enjoying treats like cakes and dishes like lasagne that have can t have. The store had so much more choice than other local stores have to offer and I honestly almost cried when I found chocolate hazlenut spread and  cheese  sauce that I am able to give him which are flavours he has never had the chance to try. Well done Guys and a massive Thank you 😊;;;;;2016-03-23T18:22:56+0000;1458757376;2016-03-23 19:22:56;1;2;2;0;4;2;2;0;1;0;1;1;0;0;0;0;0
status;post_user_90229869376;90229869376_10154672670779377;https://www.facebook.com/90229869376/posts/10154672670779377;Can you please ask your tunbridge wells store to make sure that the active kids vouchers go out with online deliveries...... I am getting a bit fed up of mentioning it....and no  I am not going to take all of my receipts in store to collect them  as I shop online for a very good reason. Sorry to be narky  it just makes me a bit cross  when they should automatically print from the till. Thank you....rant over 😈 p.s on a lighter note  other than that  my deliveries are normally fab and the drivers lovely and helpful 😊;;;;;2016-03-23T18:06:03+0000;1458756363;2016-03-23 19:06:03;0;1;0;0;1;1;1;0;0;0;0;0;0;0;0;0;0
status;post_user_90229869376;90229869376_10154672635924377;https://www.facebook.com/90229869376/posts/10154672635924377;How rubbish are you today ? Very is the answer I visited the store Saturday for gluten:dairy free mayonnaise ...was it there ?no grrrr visited again today after trying the local store was it there ..... Noooooo  Was there any staff to be found in the aisles? ...... Noooooo   Rating of 1 to 5 5 being good  = -1 and that s being generous   Not good enough really for a big store :( bitterly disappointed 😡;;;;;2016-03-23T17:55:16+0000;1458755716;2016-03-23 18:55:16;0;3;0;0;3;3;1;2;0;0;0;0;0;0;0;0;0
status;post_user_90229869376;90229869376_10154672470339377;https://www.facebook.com/90229869376/posts/10154672470339377;Does Sainsburys stock any of the new Lego Disney Princess Palace Pets (eg 41140  41141 41142) range please?;;;;;2016-03-23T17:16:41+0000;1458753401;2016-03-23 18:16:41;0;4;0;0;4;4;1;3;0;0;0;0;0;0;0;0;0
status;post_user_90229869376;90229869376_10154672464834377;https://www.facebook.com/90229869376/posts/10154672464834377;Is the decline in Sainsbury s food products a purposeful business decision to cut costs? Or is it unintentional? Just this week I ve thrown out deceptively rotten bananas  mouldy mixed nuts and a thai chicken soup that tasted like Mr Muscle and gave me a stomach ache. Last week it was crunchy tomatoes. Crunchy. Almost everything I buy from your store was better quality a year ago. Why?;;;;;2016-03-23T17:15:53+0000;1458753353;2016-03-23 18:15:53;2;4;2;0;6;4;1;3;0;0;2;0;0;0;0;0;0
status;post_user_90229869376;90229869376_10154672223324377;https://www.facebook.com/90229869376/posts/10154672223324377;Hi! Does the Dalston store stock Green& Blacks Easter eggs?;;;;;2016-03-23T16:12:06+0000;1458749526;2016-03-23 17:12:06;0;3;0;0;3;3;1;2;1;0;0;0;0;0;0;0;0
status;post_user_90229869376;90229869376_10154672198724377;https://www.facebook.com/90229869376/posts/10154672198724377;A big thank you to the kind staff at Worthing Sainbury s. Spotted me pushing a very full trolley to the check out carrying one of my twin babies on my back and one on my front. They opened a checkout for me  unloaded and offered to pack my shopping. Such a great help!😄;;;;;2016-03-23T16:04:47+0000;1458749087;2016-03-23 17:04:47;2;1;2;0;3;1;1;0;0;0;2;0;0;0;0;0;0
status;post_user_90229869376;90229869376_10154671970624377;https://www.facebook.com/90229869376/posts/10154671970624377;Sainsburys going right down in my estimation!  Not only have they stopped selling their own label dried herbs and spices they no longer sell Bottle Green cordial!  :-(;;;;;2016-03-23T14:52:57+0000;1458744777;2016-03-23 15:52:57;0;1;0;0;1;1;1;0;0;0;0;0;0;0;0;0;0
status;post_user_90229869376;90229869376_10154671912214377;https://www.facebook.com/90229869376/posts/10154671912214377;Absolutely disgusted with Sainsburys.  After 4 years of shopping online with you we have been treated appallingly.  In my order 2 weeks ago I ordered one pack of gluten free hot cross buns from your Swindon store.  Your store substituted my order with 11 packs of scones and only sent me one pack.    Despite two calls to customer services and on the second call a callback from your swindon store assuring me they will be refunding my money nothing has been done.    I m fuming that I have been left £20.00 out of pocket on items I didn t even order and I have been lied to by your staff!  Moreover the items that were damaged in my shopping orders over the last two weeks have been refunded to the value of £5.75 in a online voucher code forcing me to spend more money with your store to claim back my refund.    This included a pack of sausage rolls were 3 had been taken out (I presume for someone s lunch!) and no trace of the errant sausage rolls or crimps were anywhere in the pallet.  Your home service and customer services is laughable.  I feel like you have stollen £20.00 out of my purse.  As you have taken money from my bank account for items I didn t order and have not sent the wrong items you charged me for.   I won t be returning again and will be advising my family and friends to stay well clear as any mistakes you make you refuse to put right.  Any items you damage you refund in online voucher codes it s ridiculous!;;;;;2016-03-23T14:43:33+0000;1458744213;2016-03-23 15:43:33;0;12;0;0;12;12;3;9;2;0;0;0;0;0;0;0;0
status;post_user_90229869376;90229869376_10154671611024377;https://www.facebook.com/90229869376/posts/10154671611024377;Hello! I ve just noticed your household cleaners don t have the cruelty free leaping bunny in the bottles anymore. Are you still certified?  Thanks.;;;;;2016-03-23T13:17:18+0000;1458739038;2016-03-23 14:17:18;0;10;0;0;10;10;6;4;7;0;0;0;0;0;0;0;0
status;post_user_90229869376;90229869376_10154671128764377;https://www.facebook.com/90229869376/posts/10154671128764377;nice to see a member of your staff pick up an item of girls clothing and say to another staff member I ll just put this out the back that ll do for our holiday to Florida .she then put the item out back and carried on working.it was the last item in that  size so I can t buy it now.;;;;;2016-03-23T10:55:47+0000;1458730547;2016-03-23 11:55:47;0;13;0;0;13;13;4;9;18;0;0;0;0;0;0;0;0
status;post_user_90229869376;90229869376_10154670876364377;https://www.facebook.com/90229869376/posts/10154670876364377;gutted I bought #pampers nappies instead of sainsbury s basics nappies from @sainsburys in Huntingdon on 18.3.16 for the #nowtv voucher on them to find that when I opened them the promo had expired 31.1.16 ☹️ - they probably shouldn t still be on the shelves.;;;;;2016-03-23T09:30:55+0000;1458725455;2016-03-23 10:30:55;0;1;0;0;1;1;1;0;0;0;0;0;0;0;0;0;0
status;post_user_90229869376;90229869376_10154668988669377;https://www.facebook.com/90229869376/posts/10154668988669377;Literally just clicked to confirm a weeks shopping and your website cancels the delivery slot. First and last time online shopping  what a waste of time;;;;;2016-03-22T23:03:02+0000;1458687782;2016-03-23 00:03:02;1;1;1;0;2;1;1;0;0;0;1;0;0;0;0;0;0
status;post_user_90229869376;90229869376_10154668907989377;https://www.facebook.com/90229869376/posts/10154668907989377;Congratulations for fabulous customer service in your Hendon Central local store  where my friend was approached by  supervisor  and harassed in front of other customers  when she told him that he can not speak to her in this manner and point finger at her she was told that she s banned from the store and she has to leave the store without her shopping.  When her girlfriend approached this gentleman to complain she was called  an idiot .  Fabulous homophobic behaviour towards local customers shopping it this particular branch every day twice a day.  Are you teaching your staff to swear at customers whenever they are pissed off?;;;;;2016-03-22T22:40:38+0000;1458686438;2016-03-22 23:40:38;0;8;0;0;8;8;7;1;18;0;0;0;0;0;0;0;0
status;post_user_90229869376;90229869376_10154668701199377;https://www.facebook.com/90229869376/posts/10154668701199377;Hi Sainsbury s  will you have Remington Keratin Therapy Pro Volume hairbrush for sale again?;;;;;2016-03-22T21:27:58+0000;1458682078;2016-03-22 22:27:58;0;5;0;0;5;5;1;4;0;0;0;0;0;0;0;0;0
status;post_user_90229869376;90229869376_10154668599639377;https://www.facebook.com/90229869376/posts/10154668599639377;The air machine at your Colindale store has now been Out of Order for the last week.  All your staff can tell me is that  its been reported .  Surely Sainsbury is large enough to get some clout to ensure you contractors attend more promptly?  I am not impressed!;;;;;2016-03-22T20:56:35+0000;1458680195;2016-03-22 21:56:35;0;4;0;0;4;4;3;1;0;0;0;0;0;0;0;0;0
status;post_user_90229869376;90229869376_10154668591044377;https://www.facebook.com/90229869376/posts/10154668591044377;Why have you changed the UX in your website.......? It s horrific  takes twice as long to put things in basket.;;;;;2016-03-22T20:54:07+0000;1458680047;2016-03-22 21:54:07;0;3;0;0;3;3;1;2;0;0;0;0;0;0;0;0;0
status;post_user_90229869376;90229869376_10154668389504377;https://www.facebook.com/90229869376/posts/10154668389504377;Today I was informed after trying to buy my 4 month old some milk as she has 6 bottles a day roughly I thought I Best Buy her 6 to last me the whole day.......but no I was only allowed to buy 2 bottles which does me not even half of the day and was told I couldn t even do separate  transactions. I am totally fuming my daughter suffers from Constipation and I was informed by my health visitor to put her on pre made milk  yet my supermarket won t even let me buy a days worth it s actually pathetic I won t be shopping at Sainsbury s again as I went into Tesco  straight after Sainsbury s and managed to get 10 bottles without  any trouble so you have lost me as a customer!!! how can you not allow a Mother to buy her baby enough milk for the day ahead actually so angry i think you should rethink your policy s 😡😡😡😡😡😡😡;;;;;2016-03-22T20:06:15+0000;1458677175;2016-03-22 21:06:15;0;5;0;0;5;5;2;3;1;0;0;0;0;0;0;0;0
status;post_user_90229869376;90229869376_10154668259479377;https://www.facebook.com/90229869376/posts/10154668259479377;I have sent a private message regarding my shopping delivery  can you please check it and get back to me? Thanks.;;;;;2016-03-22T19:26:56+0000;1458674816;2016-03-22 20:26:56;1;2;1;0;3;2;1;1;1;0;1;0;0;0;0;0;0
status;post_user_90229869376;90229869376_10154667859144377;https://www.facebook.com/90229869376/posts/10154667859144377;Just had to write to say what a great store you have on Ashridge Road Wokingham Berks. They nominated the Nursery I work for with a £100 token as community gift. We go in there twice a week with the children to buy our snack and milk shopping which the children choose. The staff are always great with the children  so a big THANK YOU from all the children and staff at Ashridge Nursery it is very much appreciated 😀 xxz;;;;;2016-03-22T17:34:32+0000;1458668072;2016-03-22 18:34:32;27;12;27;1;40;12;11;1;1;0;27;0;0;0;0;0;0
status;post_user_90229869376;90229869376_10154667643224377;https://www.facebook.com/90229869376/posts/10154667643224377;Hello   did you know that Waitrose   have decided not to sell Roundup   the carcinogenic poison.  Removing it from the shelves. I was wondering if Sainsburys had any comment to make about this. I also wondered if Sainsburys may just do the same. Heres hoping then. Best Regards;;;;;2016-03-22T16:37:20+0000;1458664640;2016-03-22 17:37:20;0;2;0;0;2;2;1;1;0;0;0;0;0;0;0;0;0
status;post_user_90229869376;90229869376_10154667633344377;https://www.facebook.com/90229869376/posts/10154667633344377;Hello.  I bought an Avengers Comic towel at your Trinity Walk store Wakefield on 16 March  it was reduced to £6.67  but i ve just been looking at my receipts and i ve been charged £10. Can you please look in to this  as it was clearly reduced on the shelf with a red ticket. Thanks.;;;;;2016-03-22T16:34:07+0000;1458664447;2016-03-22 17:34:07;0;12;0;0;12;12;4;8;1;0;0;0;0;0;0;0;0
status;post_user_90229869376;90229869376_10154667226279377;https://www.facebook.com/90229869376/posts/10154667226279377;How daft .... toasted tea cakes toasted at food service counter .... but toasted hot cross buns have to be toasted in kitchen ..... after waiting 20 mins I d finished my coffee and had to go ....so never got my hot cross bun;;;;;2016-03-22T14:44:18+0000;1458657858;2016-03-22 15:44:18;0;5;0;0;5;5;1;4;1;0;0;0;0;0;0;0;0
status;post_user_90229869376;90229869376_10154667157649377;https://www.facebook.com/90229869376/posts/10154667157649377;Hello I just wanted to make your customers aware of your dodgy trading.  Be careful what you order online because they change it and charge you more.  You give details of your card and think your order is processed and the offers are valid  however when your order arrives you have been charged a lot more.  Scandalous way to make a living;;;;;2016-03-22T14:20:23+0000;1458656423;2016-03-22 15:20:23;0;11;0;1;12;11;2;9;7;0;0;0;0;0;0;0;0
status;post_user_90229869376;90229869376_10154667111789377;https://www.facebook.com/90229869376/posts/10154667111789377;Hello. I just want to say how lovely a member of staff was to me earlier today in my local Epsom  Kiln Lane store.  I had my daughter in a wheelchair and I dropped my basket which  had a plant pot in and it smashed. In a stressful time..and feeling awful about breaking the plant pot...the lady was so lovely and helpful with me.  I didn t get her name....but I wanted to let you know.  Thank you.;;;;;2016-03-22T14:03:48+0000;1458655428;2016-03-22 15:03:48;13;6;13;0;19;6;4;2;6;0;13;0;0;0;0;0;0
status;post_user_90229869376;90229869376_10154666735029377;https://www.facebook.com/90229869376/posts/10154666735029377;Very disappointed with horizon parking services managing the Billet Street store parking. They take up to 35 days to respond to appeals. I received a ticket whilst getting change for the parking meter  could you not go cashless. Had an email from a Sainsburys that s doesn t make sense what s going on! n;;;;;2016-03-22T11:58:06+0000;1458647886;2016-03-22 12:58:06;1;13;1;0;14
status;post_user_90229869376;90229869376_10154666504729377;https://www.facebook.com/90229869376/posts/10154666504729377;I was in your store in farm borough  Hampshire last Tuesday at around 7:15  I went through the self service tills but I didn t get a receipt  I need this to claim back the purchase from work. Please can you help.;;;;;2016-03-22T10:31:01+0000;1458642661;2016-03-22 11:31:01;0;1;0;0;1;1;1;0;0;0;0;0;0;0;0;0;0
status;post_user_90229869376;90229869376_10154666456339377;https://www.facebook.com/90229869376/posts/10154666456339377;I have just taken delivery of my weekly shop and am significantly disappointed to receive - yet again! - items that are dated to use by or best before today or tomorrow. This is the third delivery I have received with this issue and I think it is unfair and ignorant for your company to send out goods that in store today would be heavily reduced in price. As a delivery company choosing produce on your customers behalf you should take the time to choose the longest date possible as your customers would do in store. Please advise how I can proceed with this complaint further or indeed how we can rectify this as I am not happy at all. Julie;;;;;2016-03-22T10:11:56+0000;1458641516;2016-03-22 11:11:56;0;1;0;0;1;1;1;0;0;0;0;0;0;0;0;0;0
status;post_user_90229869376;90229869376_10154666391479377;https://www.facebook.com/90229869376/posts/10154666391479377;Since when does the 10am slot start at 9:40am...???????;;;;;2016-03-22T09:48:37+0000;1458640117;2016-03-22 10:48:37;0;3;0;1;4;3;1;2;0;0;0;0;0;0;0;0;0
status;post_user_90229869376;90229869376_10154666298844377;https://www.facebook.com/90229869376/posts/10154666298844377;I am absolutely FURIOUS! I went online to look at clothes. An advert popped up to win £500 voucher. Asked for my mobile number to confirm entry. Now it seems I have contracted in to a site costing me £4.50/week to enter competitions I do not wish to enter. I am having no luck getting out so far. What will you do about this appalling treatment of a customer - senior citizen at that?;;;;;2016-03-22T09:20:39+0000;1458638439;2016-03-22 10:20:39;0;17;0;1;18;17;6;11;18;0;0;0;0;0;0;0;0
status;post_user_90229869376;90229869376_10154666133719377;https://www.facebook.com/90229869376/posts/10154666133719377;Hi sainsburys when does the 25% off clothing start?;;;;;2016-03-22T08:25:59+0000;1458635159;2016-03-22 09:25:59;0;10;0;0;10;10;4;6;2;0;0;0;0;0;0;0;0
status;post_user_90229869376;90229869376_10154664389369377;https://www.facebook.com/90229869376/posts/10154664389369377;Just want to say please don t stop selling your well fired loaf. It is so tasty and the more well fired the better.;;;;;2016-03-21T23:13:11+0000;1458601991;2016-03-22 00:13:11;0;0;0;0;0;0;0;0;0;0;0;0;0;0;0;0;0
