status;post_user_90229869376;90229869376_10154711967464377;https://www.facebook.com/90229869376/posts/10154711967464377;Hello. We ve recently switched from Highland Spring still spa water 500ml to your own still Scottish mountain water. We find it a good alternative but it is extremely difficult to open new bottles. Some have proved impossible to open without visiting the tool shed. I wonder whether you have received other complaints already but if not could I ask you to see whether this is a problem which needs attention. I am in my early 60 s and I cannot imagine how much more difficult someone older  or a child with their lunch box  would find this product.;;;;;2016-03-31T21:57:13+0000;1459461433;2016-03-31 23:57:13;0;13;0;0;13;13;3;10;0;0;0;0;0;0;0;0;0
status;post_user_90229869376;90229869376_10154711916049377;https://www.facebook.com/90229869376/posts/10154711916049377;Today Sainsburys restored my faith in customer service and went above and beyond to correct a mistake that their online service had made. On Monday I ordered 2 beautiful flower girl dresses online. The purchase went through successfully and I received a confirmation email.   I needed one other size which was not in stock online and found out that the nearest store that stocked it was a 3 hour round trip away. I proceeded to drive to the store as I needed the dress for my up-coming wedding.   I then received an email last night stating that Sainsburys could not complete my online order are were now unable to send me one of the dresses!! I was a bit shocked and rang my nearest store in Northampton.   Claire and her Team could not have done more to help. They managed to find a local member of staff that was working at the store 1.5hrs away who picked up the dress and bought it back to my local store for me to pick up!!!   Fantastic service and members of staff going above and beyond to rectify their online store issues!  10/10!!!   Best wishes  from one very happy customer!!;;;;;2016-03-31T21:43:27+0000;1459460607;2016-03-31 23:43:27;77;7;79;1;87;7;7;0;27;0;77;2;0;0;0;0;0
status;post_user_90229869376;90229869376_10154711619019377;https://www.facebook.com/90229869376/posts/10154711619019377;Yet again Sainsburys seems to have decided I no longer like something. This time its Oatibix Flakes. None on store shelves and none online. Thanks for nothing.;;;;;2016-03-31T20:38:36+0000;1459456716;2016-03-31 22:38:36;0;3;0;0;3;3;3;0;0;0;0;0;0;0;0;0;0
status;post_user_90229869376;90229869376_10154711533334377;https://www.facebook.com/90229869376/posts/10154711533334377;What is the reason counter range deli meats are no longer available online is this just a temporary measure  my grocery orders come from the Pontypridd store.  Sainsbury s Breaded Ham Slices x4 Sainsbury s Drury Lane Ham  4 Slices Sainsbury s Roast Topside Of Beef  3 Slices Sainsbury s Roast Turkey  4 Slices;;;;;2016-03-31T20:21:47+0000;1459455707;2016-03-31 22:21:47;0;5;0;0;5;5;1;4;0;0;0;0;0;0;0;0;0
status;post_user_90229869376;90229869376_10154711302864377;https://www.facebook.com/90229869376/posts/10154711302864377;Well Sainsburys  I have just taken delivery of my first online shop   no complaints from me at all..   I want to make you aware that your delivery driver Mike was brilliant.   A lovely man and very friendly.  I will definitely be ordering from you again..  I hope all delivery drivers are like him..  Well done Mike  and well done Sainsburys!  :-);;;;;2016-03-31T19:31:21+0000;1459452681;2016-03-31 21:31:21;1;1;1;0;2;1;1;0;0;0;1;0;0;0;0;0;0
status;post_user_90229869376;90229869376_10154711279089377;https://www.facebook.com/90229869376/posts/10154711279089377;Are music CDs are included in double up;;;;;2016-03-31T19:26:06+0000;1459452366;2016-03-31 21:26:06;0;0;0;0;0;0;0;0;0;0;0;0;0;0;0;0;0
status;post_user_90229869376;90229869376_10154710647004377;https://www.facebook.com/90229869376/posts/10154710647004377;Bought a tub of blackberries at prince Edward road South Shields store today  they had a small rip in the plastic.  Cashier offered to change and I said oh it s fine it s probably from   Stacking the packs.....used to make a fruit salad and as I poured blackberries out a used piece of chewing gum inside.....how disgusting is someone to poke a hole in a punnet of fruit to dispose of something that s been in their mouth!;;;;;2016-03-31T17:01:41+0000;1459443701;2016-03-31 19:01:41;1;7;1;0;8;7;4;3;0;0;1;0;0;0;0;0;0
status;post_user_90229869376;90229869376_10154710328124377;https://www.facebook.com/90229869376/posts/10154710328124377;Not a great experience today at Sainsburys Swadlincote. The double up points scheme is a great idea but doesn t work when the staff don t know which category your items are under.  One lady counted up the items in my basket with me and got my vouchers from Customer Services  however both she and the lady on the checkout didn t realise that a £10 item was Electrical  not Homeware. I was told the only option was to spend more on Homeware and get an Electrical voucher as they can t be changed. I ended up having to go to 3 different tills and in the confusion I forgot to hand over my nectar voucher and wasn t offered my active kids vouchers. Not great with 2 young children and a pushchair.  Why not just have double up vouchers which can be used across the departments and keep it simple for everyone?;;;;;2016-03-31T15:01:15+0000;1459436475;2016-03-31 17:01:15;1;3;1;0;4
status;post_user_90229869376;90229869376_10154710242474377;https://www.facebook.com/90229869376/posts/10154710242474377;I hate Sainsburys.  They are  economical with the truth    The Double Your Nectar posters in the store have illustrations showing a TV and other expensive items.  The small  small  small print indicates that the maximum discount is £20.  I have wasted 2 hours going to buy a £120 Fitbit which I hoped to get for £60.  I had phoned to check that it was in stock.  It was  but was not on display.  It took them 30 minutes to find it  and then I was told about the small print.  The item is available from Amazon for less than the £100 Saisburys want.;;;;;2016-03-31T14:28:02+0000;1459434482;2016-03-31 16:28:02;1;6;1;0;7;6;6;0;0;0;1;0;0;0;0;0;0
status;post_user_90229869376;90229869376_10154710120034377;https://www.facebook.com/90229869376/posts/10154710120034377;do sainsburys sell george hover 3 in 1;;;;;2016-03-31T13:45:14+0000;1459431914;2016-03-31 15:45:14;0;3;0;0;3;3;1;2;0;0;0;0;0;0;0;0;0
status;post_user_90229869376;90229869376_10154709684389377;https://www.facebook.com/90229869376/posts/10154709684389377;I love your sweetcorn relish but would it be possible to make the bottles easier to squeeze as its hard to get it out;;;;;2016-03-31T11:01:33+0000;1459422093;2016-03-31 13:01:33;0;1;0;0;1;1;1;0;0;0;0;0;0;0;0;0;0
status;post_user_90229869376;90229869376_10154709582459377;https://www.facebook.com/90229869376/posts/10154709582459377;Rather dissapointed following a trip to one of your stores this morning. Your longer length skirts and dresses are very long  i a 5ft 6  so average height  and yet these garments trailled about 4 inches on the floor. I assume you only expect exceptionally tall people to buy them? Perhaps you need to look at your clothing lengths so you can cater to those of us who are obviously very short;;;;;2016-03-31T10:27:11+0000;1459420031;2016-03-31 12:27:11;1;6;1;0;7;6;2;4;0;0;1;0;0;0;0;0;0
status;post_user_90229869376;90229869376_10154709573839377;https://www.facebook.com/90229869376/posts/10154709573839377;I m normally impressed with flowers and longevity you sell  but oh dear my gift flowers yesterday are a disaster. She bought them straight here after purchase yester from Rhyl store and they were completely dry  doesn t any store member check buckets actually have water? They were cut and put in water straight away  well that s after I was trying to not let all the greenery and red leaves go everywhere  as soon as they were touch it just fell off. One rose is already dead and thistle like flower heads just squashed and gone over. My friend owned a florists and I know how fresh flowers are THESE AREN T FRESH. The label says 5 days freshness  sadly  not even 5 minutes. Feeling sad and annoyed that my daughter bought them due to being unwell and has wasted her hard earned money.;;;;;2016-03-31T10:21:29+0000;1459419689;2016-03-31 12:21:29;0;12;0;0;12;12;3;9;0;0;0;0;0;0;0;0;0
status;post_user_90229869376;90229869376_10154709361354377;https://www.facebook.com/90229869376/posts/10154709361354377;Having problems logging in  saying e mail is not right or card number is incorrect  trying to register on my coupons. any ideas?;;;;;2016-03-31T09:04:54+0000;1459415094;2016-03-31 11:04:54;0;1;0;0;1
status;post_user_90229869376;90229869376_10154707280204377;https://www.facebook.com/90229869376/posts/10154707280204377;Why is Sainsburys garage always running out of diesel fuel  is there a national problem or global matters?;;;;;2016-03-30T22:25:05+0000;1459376705;2016-03-31 00:25:05;0;1;0;0;1;1;1;0;0;0;0;0;0;0;0;0;0
status;post_user_90229869376;90229869376_10154707127894377;https://www.facebook.com/90229869376/posts/10154707127894377;It s a shame about this years double up. For the past two years I ve purchased Xbox credit as it came under entertainment and tried again this year and because there technically classed as gift cards they don t work. Colleagues were confused too as it only said the only thing that wasn t included in entertainment was  entertainment on demand  and the Xbox credit is located with all the entertainment items.;;;;;2016-03-30T21:44:44+0000;1459374284;2016-03-30 23:44:44;1;5;1;0;6;5;4;1;0;0;1;0;0;0;0;0;0
status;post_user_90229869376;90229869376_10154707104479377;https://www.facebook.com/90229869376/posts/10154707104479377;are the ipad air 2 or ipad air pros included in the nectar as i am struggling to find electronics on you site?;;;;;2016-03-30T21:39:28+0000;1459373968;2016-03-30 23:39:28;0;2;0;0;2;2;1;1;1;0;0;0;0;0;0;0;0
status;post_user_90229869376;90229869376_10154707071664377;https://www.facebook.com/90229869376/posts/10154707071664377;So chuffed  I did a sponsored walk in aid of sports relief & raised £426!!  I walked 3 miles round Leeds  Whiterose store!!  It was quite an achievement as I ve had 2 hip replacements & 2 knee replacements!!  Thanks to everyone who took the time to sponsor & support me!!;;;;;2016-03-30T21:28:58+0000;1459373338;2016-03-30 23:28:58;2;0;2;0;2;0;0;0;0;0;2;0;0;0;0;0;0
status;post_user_90229869376;90229869376_10154706899574377;https://www.facebook.com/90229869376/posts/10154706899574377;I have been using Sainsburys online shopping service for a number of years on a weekly basis. I am really annoyed as after paying on line as normal for my weekly shop  a random debit was made on my account for £255.64 the reference was JS online grocery. Sainsburys have not paid back this incorrect debit or done anything to investigate this. Customer Service have been really unhelpful and I am really unhappy that you have taken such a large amount from my account and that my account has been compromised.  This is unacceptable and Sainsburys should be investigating with the store as to how this has happened and getting my money back to me !!!;;;;;2016-03-30T20:39:34+0000;1459370374;2016-03-30 22:39:34;0;5;0;0;5;5;2;3;0;0;0;0;0;0;0;0;0
status;post_user_90229869376;90229869376_10154706865619377;https://www.facebook.com/90229869376/posts/10154706865619377;please can anyone help me ..before easter in our local store there was some spinning musical easter chick s my little boy desperately wanted one but they were £10  he kept asking to go to the shop so he could play with them  I was hoping to get one for him after they were reduced a little and now I can t find any anywhere either in our local store or main supermarket  I feel really guilty not getting him one now  do you know where I could get hold of one please?;;;;;2016-03-30T20:27:17+0000;1459369637;2016-03-30 22:27:17;0;6;0;0;6;6;2;4;0;0;0;0;0;0;0;0;0
status;post_user_90229869376;90229869376_10154706640184377;https://www.facebook.com/90229869376/posts/10154706640184377;Hello Sainsburys. Quick question. Why in a bag of 3 mixed peppers is the third one green? No one likes the green one. I ve asked a few friends and we d all prefer it if the three were red  orange and yellow. Cheers.;;;;;2016-03-30T19:34:27+0000;1459366467;2016-03-30 21:34:27;2;5;2;1;8;5;5;0;0;0;2;0;0;0;0;0;0
status;post_user_90229869376;90229869376_10154706605439377;https://www.facebook.com/90229869376/posts/10154706605439377;Not very impressed daughter has just bought a packet of biscuits that tasted strange  closer inspection reveals that they were dated December 2015...... very very poor show Sainsburys -;;;;;2016-03-30T19:26:36+0000;1459365996;2016-03-30 21:26:36;0;1;0;0;1;1;1;0;0;0;0;0;0;0;0;0;0
status;post_user_90229869376;90229869376_10154706542289377;https://www.facebook.com/90229869376/posts/10154706542289377;why at around 1400 on a wed afternoon are there only 3/4 checkouts open? this is just not on.no basket checkouts only self service which are useless.only usefull fag desk very poor again.grimsby corporation rd.rant over.;;;;;2016-03-30T19:11:16+0000;1459365076;2016-03-30 21:11:16;0;3;1;0;4;3;1;2;1;0;0;0;1;0;0;0;0
status;post_user_90229869376;90229869376_10154706405254377;https://www.facebook.com/90229869376/posts/10154706405254377;Thank you for selling girly dinosaur pjs (not just for boys!) our little girl loves them.😄;;;;;2016-03-30T18:33:31+0000;1459362811;2016-03-30 20:33:31;3;4;3;0;7;4;4;0;3;0;3;0;0;0;0;0;0
status;post_user_90229869376;90229869376_10154706313744377;https://www.facebook.com/90229869376/posts/10154706313744377;I would just like to thank Linda Korczynski on behalf of pontllanfraith primary pta for the very kind donation of the easter decorations from our store at pontllanfraith. As always linda is always willing to help us and the community. Very much appreciated again linda for your support xxx;;;;;2016-03-30T18:03:12+0000;1459360992;2016-03-30 20:03:12;11;1;11;0;12;1;1;0;0;0;11;0;0;0;0;0;0
status;post_user_90229869376;90229869376_10154706261749377;https://www.facebook.com/90229869376/posts/10154706261749377;What s happened to your Ready Salted Potato Triangles? They were one of my favourites!;;;;;2016-03-30T17:49:50+0000;1459360190;2016-03-30 19:49:50;0;5;0;0;5;5;1;4;1;0;0;0;0;0;0;0;0
status;post_user_90229869376;90229869376_10154706192114377;https://www.facebook.com/90229869376/posts/10154706192114377;Bad show to Sainsbury s Winnersh  i purchased 72 easter eggs to donate to The Berkshire Egg Run  i asked before i paid for the egg if the Winnersh branch would match my donation but they refused to...... Bad show :/;;;;;2016-03-30T17:32:40+0000;1459359160;2016-03-30 19:32:40;0;2;0;0;2;2;2;0;7;0;0;0;0;0;0;0;0
status;post_user_90229869376;90229869376_10154706168429377;https://www.facebook.com/90229869376/posts/10154706168429377;Hello Sainsbury s. Was just looking at your collection of technology online  and I only see 3 models of Laptops. Am I right?;;;;;2016-03-30T17:26:01+0000;1459358761;2016-03-30 19:26:01;0;1;0;0;1;1;1;0;0;0;0;0;0;0;0;0;0
status;post_user_90229869376;90229869376_10154706059169377;https://www.facebook.com/90229869376/posts/10154706059169377;In light of my belief that good people shouldn t go by unnoticed or un-thanked  I finally got the name of a member of staff from a Sainsburys express on Southbourne Highstreet in Bournemouth Dorset. His name is Gary and for however long he has worked there he has always been the most polite and lovely member of staff anyone could wish for. Whenever I visit the store and he is serving  I feel honoured to be served by him. he is always enthusiastic and shows care and interest to all your customers. It s an attitude you rarely see now  most people are so consumed with hate for their jobs or in their own lives that serving someone seems a chore or as if it s getting in the way of their life. But not for Gary. He is a true gent and professional and the community of Southbourne thank him. We also really think you ought to know when a member of staff is so outstanding.;;;;;2016-03-30T16:51:43+0000;1459356703;2016-03-30 18:51:43;0;1;0;0;1;1;1;0;0;0;0;0;0;0;0;0;0
status;post_user_90229869376;90229869376_10154705665974377;https://www.facebook.com/90229869376/posts/10154705665974377;Why can t I find Bisto Cheese Sauce in the Northfield branch anymore? Also Bisto (I think!) Parsley Sauce and Sainsbury s Economy Coffee (in the pouches)?;;;;;2016-03-30T14:46:24+0000;1459349184;2016-03-30 16:46:24;1;9;1;0;10;7;3;4;2;0;1;0;0;0;0;0;0
status;post_user_90229869376;90229869376_10154705543284377;https://www.facebook.com/90229869376/posts/10154705543284377;Good afternoon  following the closure of the Mobile by Sainsbury business I have been waiting since mid Nov (4.5 months) for the return of my mobile phone credit. I have already spent a considerable amount of time ringing and emailing several times. I just receive generic replies and no action (please note that when I was asked by Sainsbury to add credit it was taken from my account the same day). I would like the matter to be closed in the next couple of days. Can you please escalate to whom it may concern and have somebody getting in touch with me? Many thanks;;;;;2016-03-30T14:03:55+0000;1459346635;2016-03-30 16:03:55;0;3;0;0;3;3;2;1;0;0;0;0;0;0;0;0;0
status;post_user_90229869376;90229869376_10154705543029377;https://www.facebook.com/90229869376/posts/10154705543029377;Been waiting over a month for a refund for items not received. I ve signed and returned the declaration you sent me;;;;;2016-03-30T14:03:44+0000;1459346624;2016-03-30 16:03:44;0;1;0;0;1;1;1;0;0;0;0;0;0;0;0;0;0
status;post_user_90229869376;90229869376_10154705479849377;https://www.facebook.com/90229869376/posts/10154705479849377;My baby daughter hurt her face when sitting in the trolley this morning in sainsbury s Bridgend. A helpful member of staff opened a till for me  he unpacked all my trolley and made sure I had help repacking. Helpfulness and kindness really go along way. Thank you! Xx;;;;;2016-03-30T13:46:10+0000;1459345570;2016-03-30 15:46:10;1;1;1;0;2;1;1;0;1;0;1;0;0;0;0;0;0
status;post_user_90229869376;90229869376_10154705285039377;https://www.facebook.com/90229869376/posts/10154705285039377;Wanted to say a Thank You to the customer service desk at the East Mayne  Basildon store for their patience and assistance today.  Particular thank you to Sue  she was very helpful!;;;;;2016-03-30T12:32:10+0000;1459341130;2016-03-30 14:32:10;1;1;1;0;2;1;1;0;0;0;1;0;0;0;0;0;0
status;post_user_90229869376;90229869376_10154705193314377;https://www.facebook.com/90229869376/posts/10154705193314377;Awful online grocery shopping experience again!!! When will you get your act together? The guy at customer service centre didn t even want to give me his first name so I had a record of my call if and when I need to chase my refund  which I probably will as I ve been here before! Back to Tesco for me...;;;;;2016-03-30T11:58:13+0000;1459339093;2016-03-30 13:58:13;0;1;0;0;1;1;1;0;0;0;0;0;0;0;0;0;0
status;post_user_90229869376;90229869376_10154705043904377;https://www.facebook.com/90229869376/posts/10154705043904377;Today I received 2 soggy sweet potatoes in my online delivery! Why n how did this happen?;;;;;2016-03-30T11:15:41+0000;1459336541;2016-03-30 13:15:41;0;7;1;0;8;6;3;3;0;0;0;0;0;0;0;1;0
status;post_user_90229869376;90229869376_10154705020869377;https://www.facebook.com/90229869376/posts/10154705020869377;I ve been waiting over an hour for an order to arrive and now I m waiting over 12 minutes for a so-called  Live Chat  to start so I can ask when I might expect the delivery actually arrive.  Please get your act together - this is the 21st century and you shouldn t promise stuff that you can t deliver.;;;;;2016-03-30T11:04:58+0000;1459335898;2016-03-30 13:04:58;0;12;0;0;12;12;1;11;0;0;0;0;0;0;0;0;0
status;post_user_90229869376;90229869376_10154704920554377;https://www.facebook.com/90229869376/posts/10154704920554377;Hi  I ordered my food shopping online yesterday  and decided to buy the Good Dinosaur for my kids. When I searched I saw there was an offer  buy one DVD get a 2nd for £5 . So I checked what other DVDs were in the offer  and ordered Crimson Peak. My delivery has come today  and it s not showing the offer applied on my receipt  so I ve been charged the full price for both DVDs. I double checked they were both in the offer  so why have I been charged full price?;;;;;2016-03-30T10:27:53+0000;1459333673;2016-03-30 12:27:53;0;2;0;0;2;2;2;0;0;0;0;0;0;0;0;0;0
status;post_user_90229869376;90229869376_10154704904279377;https://www.facebook.com/90229869376/posts/10154704904279377;That feeling when you buy a tv and the picture goes blank leaving with sound it s less than two years old and your left non the wiser how to fix the tv try and contact sainburys and they say they can t do nothing as it s over a year old  but maybe call the store as the manger to see if they can help about returns etc and look online for celcus the people who make the telly as it s still under warranty as it s less than three years old and it s the same  phone number you called up earlier and got no were with so this makes no sense  guess it s lesson leant buy cheap in store  buy twice !!!!!!! Top customer service not !!!!!!!!!!;;;;;2016-03-30T10:17:49+0000;1459333069;2016-03-30 12:17:49;1;9;1;0;10;9;4;5;3;0;1;0;0;0;0;0;0
status;post_user_90229869376;90229869376_10154704818119377;https://www.facebook.com/90229869376/posts/10154704818119377;Why do you never have any of the biggest blue top milk in your Perton store? Every time I go in there isn t any and I go at different times every day. I don t fancy sitting by my window day in day out waiting to see when the Wiseman delivery goes past.;;;;;2016-03-30T09:55:33+0000;1459331733;2016-03-30 11:55:33;0;8;0;0;8;8;3;5;0;0;0;0;0;0;0;0;0
status;post_user_90229869376;90229869376_10154704714744377;https://www.facebook.com/90229869376/posts/10154704714744377;Has the receipe changed for your own brand low salt  low sugar beans? They have become quite powdery and are not nice.;;;;;2016-03-30T09:21:37+0000;1459329697;2016-03-30 11:21:37;0;5;0;0;5;5;4;1;0;0;0;0;0;0;0;0;0
status;post_user_90229869376;90229869376_10154704545849377;https://www.facebook.com/90229869376/posts/10154704545849377;Dear Sainsburys   There are some hidden heroes in your Haywards Heath store who do good every day but don t get much credit.  I want to publicly thank Roger who works in the car park collecting trolleys.  I d had an....interesting morning with my non sleeper 4 month old (I m sure parents out there can relate) and Roger was so friendly and offered to go and get me a trolley I could put my car seat on. He went out of his way to help me and bring it to my car. When I said thank you he just replied that he will always help and all I need to do is ask.   I know it s only a small thing but he didn t have to do that and I really appreciated it!!  When I left I saw him collecting a wheelchair for an older lady and was helping her out of her taxi.   Roger  thank you for going the extra mile for people  you put a smile on my face!! You never know what kind of a day people are having and little acts of kindness go a long way!   Not sure if you do rewards for employees but I think Roger deserves one! From what I hear this is not a one off  he does good every day!   ❤️;;;;;2016-03-30T08:03:22+0000;1459325002;2016-03-30 10:03:22;9;2;9;0;11;2;2;0;0;0;9;0;0;0;0;0;0
status;post_user_90229869376;90229869376_10154704357704377;https://www.facebook.com/90229869376/posts/10154704357704377;When doing an online shop  is there anyway of ensuring I receive British produce?;;;;;2016-03-30T06:40:32+0000;1459320032;2016-03-30 08:40:32;0;1;0;0;1;1;1;0;0;0;0;0;0;0;0;0;0
status;post_user_90229869376;90229869376_10154702538464377;https://www.facebook.com/90229869376/posts/10154702538464377;VERY impressed with how quickly our order from TU was processed and sent out  even with the bank hol weekend!!! AWESOME. Thank you!;;;;;2016-03-29T22:29:55+0000;1459290595;2016-03-30 00:29:55;1;0;1;0;1;0;0;0;0;0;1;0;0;0;0;0;0
status;post_user_90229869376;90229869376_10154702324449377;https://www.facebook.com/90229869376/posts/10154702324449377;is it poss to return a birthday cake;;;;;2016-03-29T21:21:31+0000;1459286491;2016-03-29 23:21:31;0;3;0;0;3;3;2;1;0;0;0;0;0;0;0;0;0
status;post_user_90229869376;90229869376_10154702117844377;https://www.facebook.com/90229869376/posts/10154702117844377;I was shocked to see two Sainsbury s staff getting out of a car  parked in the parent and child spaces. The store was still open  and they took the closest space to the doors. I guess that when it s raining staff come first before customers! I know that they are not legal parking spaces but this is poor.;;;;;2016-03-29T20:22:49+0000;1459282969;2016-03-29 22:22:49;2;26;5;0;31;26;11;15;14;0;2;0;1;0;0;2;0
status;post_user_90229869376;90229869376_10154701752859377;https://www.facebook.com/90229869376/posts/10154701752859377;Can t believe how rude the supervisor was in sainsburys forest side belfast...asked where to pay for shopping as fast track closed and get venomously told he was the only one working and was breaking his back ...good customer service ...plenty other supermarkets;;;;;2016-03-29T18:56:28+0000;1459277788;2016-03-29 20:56:28;0;1;0;0;1;1;1;0;0;0;0;0;0;0;0;0;0
