status;post_user_90229869376;90229869376_10154611021614377;https://www.facebook.com/90229869376/posts/10154611021614377;POOR CUSTOMER SERVICE ---> On Sunday I bought some Taste the Difference Sable Grapes from Sainsbury s in Heaton Park  Manchester. I sat down this evening to enjoy them and was shocked to see a fury moldy stem and lots of mushy rotting grapes. So  I took them back to the Sainsbury s in Piccadilly station (which is near to where I live) - and was disappointed to hear that the  supervisor  would not exchange these grapes (in their original packaging) as I did not have a receipt. I did not get his name but he was  supervising  at 20:35 this evening (7th March). He made me feel like the decayed rotting fruit was a result of something I had done and made me feel like I was trying to fiddle Sainsbury s over £2!!!! I was polite yet firm  despite feeling frustrated at his poor customer service  and informed him that I would be reluctant to shop in Sainsbury s again - his response was  good . He did eventualy exchange the grapes. Anyway  I think you need to educate this  supervisor  on how to deliver good customer service.;;;;;2016-03-07T21:01:50+0000;1457384510;2016-03-07 22:01:50;4;19;4;0;23;18;3;15;2;0;4;0;0;0;0;0;0
status;post_user_90229869376;90229869376_10154611005754377;https://www.facebook.com/90229869376/posts/10154611005754377;Do you have a discount code for new online shopping customers?  Mine doesn t seem to be working and want to place an order this evening. Thank you;;;;;2016-03-07T20:53:38+0000;1457384018;2016-03-07 21:53:38;0;2;0;0;2;2;1;1;0;0;0;0;0;0;0;0;0
status;post_user_90229869376;90229869376_10154611000979377;https://www.facebook.com/90229869376/posts/10154611000979377;Gutted sainsbury s you are not opening round the corner from me it would of been fantastic   such a shame can t u reconsider?;;;;;2016-03-07T20:50:03+0000;1457383803;2016-03-07 21:50:03;1;0;1;0;1;0;0;0;0;0;1;0;0;0;0;0;0
status;post_user_90229869376;90229869376_10154610905289377;https://www.facebook.com/90229869376/posts/10154610905289377;I went to my Local store this evening  (King s Lynn  Hardwick)  To pick up some clothing that was delivered.  However when I got to customer Service I was met with a rather rude young Lady who said she couldn t help me I needed to find a member of Clothing...  I went off to find Said member and to my surprise after walking around for 20 minutes there was no member of staff...  I gave up and proceeded back to Customer Service. On the way I met a young man who I decided to ask of he could assist.  His reply was  I m not a member of clothing.  You ll have to find someone else   At this point I was pretty angry so walked out without my order...  I shall of course try again tomorrow but I wanted to say how absolutely awful staff are at this store!  How no one could just simply call a member of staff and find my order.  After all I have paid money for these. I had picked up around £40 worth of extra clothing whilst looking for a member of staff... Needless to say these got left behind and I shall not be bothering to purchase these!;;;;;2016-03-07T20:07:01+0000;1457381221;2016-03-07 21:07:01;3;15;4;1;20;15;10;5;7;0;3;0;0;0;0;1;0
status;post_user_90229869376;90229869376_10154610904024377;https://www.facebook.com/90229869376/posts/10154610904024377;Just been back to you store in rhyl north wales. I was returning a pack of cream cakes that was ut of date. asked to speak to a manager. After 10minutes she comes. I explain the problem to be told it happens. I explained they had started to be eaten and a funny taste. She said its only milk its fine. Now im pretty sure use by dates are there for a reason. Not quite sure why shes even a manager. She was useless. When i asked whats shes going to do. She said you can have some more cakes. I ask for head office and only reaction i get is her wanting to keep the cakes. I could probly get over the error of dates. But after the way the so called manager acted i would like to take it further. Not only about the food but the manager;;;;;2016-03-07T20:06:07+0000;1457381167;2016-03-07 21:06:07;0;12;0;0;12;12;7;5;9;0;0;0;0;0;0;0;0
status;post_user_90229869376;90229869376_10154610859719377;https://www.facebook.com/90229869376/posts/10154610859719377;I was wondering whether sainsburys will be having a sainsburys special edition of game of thrones season 5 this year like it has done the previous two years.;;;;;2016-03-07T19:43:32+0000;1457379812;2016-03-07 20:43:32;0;2;0;0;2;2;2;0;0;0;0;0;0;0;0;0;0
status;post_user_90229869376;90229869376_10154610821904377;https://www.facebook.com/90229869376/posts/10154610821904377;For the second week running I ve not had points added on My Coupons for things I ve bought. I ve bought the correct things and yes the coupons are valid. Help!;;;;;2016-03-07T19:31:10+0000;1457379070;2016-03-07 20:31:10;0;4;0;0;4;4;1;3;0;0;0;0;0;0;0;0;0
status;post_user_90229869376;90229869376_10154610777654377;https://www.facebook.com/90229869376/posts/10154610777654377;i have 3 coupons not added from My Coupons.  Yes we bought the correct items and yes this was many days ago;;;;;2016-03-07T19:10:29+0000;1457377829;2016-03-07 20:10:29;0;19;0;0;19;19;3;16;0;0;0;0;0;0;0;0;0
status;post_user_90229869376;90229869376_10154610769209377;https://www.facebook.com/90229869376/posts/10154610769209377;Hi Sainsburys. My name is Andrew and I am a big fan of your carrot cake. The one in the meal deal. I d be happy to appear in an advert vouching for the quality of it in exchange for some free ones. You might be thinking of using Rob Brydon but that guy sells everything from crunchy nut cornflakes to P&O cruises so I think he s lost his credibility BIG TIME.   Anyway. Please let me know when we can sort something out.;;;;;2016-03-07T19:04:20+0000;1457377460;2016-03-07 20:04:20;4;11;4;0;15;11;4;7;7;0;4;0;0;0;0;0;0
status;post_user_90229869376;90229869376_10154610760574377;https://www.facebook.com/90229869376/posts/10154610760574377;You cancelled my home delivery order yesterday and despite trying numerous times to call you to discuss this and try to rearrange i was unable to get through to you. Finding out my order wasn t coming at all was bad enough but the lack of follow up and poor service from your call centre means you are at risk of losing a customer for life.;;;;;2016-03-07T19:00:49+0000;1457377249;2016-03-07 20:00:49;0;1;0;0;1;1;1;0;0;0;0;0;0;0;0;0;0
status;post_user_90229869376;90229869376_10154610630529377;https://www.facebook.com/90229869376/posts/10154610630529377;I sadly and stupidly let £50 of vouchers go past their valid until date.   They were a present so we accidentally forgot about them I put them in my bag and forgot they were there.   My daughter did the same with £20 of Next vouchers but that great retailer allowed us to send them to them to be exchanged for current ones.   Sainsburys have just said  no  we can t do that . Yet they had the money for these vouchers already.   Sainsburys I think your refusal is wrong. I think it s not fair. You have had the money and banked it.;;;;;2016-03-07T17:59:52+0000;1457373592;2016-03-07 18:59:52;1;3;1;0;4;3;1;2;2;0;1;0;0;0;0;0;0
status;post_user_90229869376;90229869376_10154610588834377;https://www.facebook.com/90229869376/posts/10154610588834377;Hi Please can you add Shout magazine to your online groceries?;;;;;2016-03-07T17:32:13+0000;1457371933;2016-03-07 18:32:13;0;5;0;0;5;4;1;3;0;0;0;0;0;0;0;0;0
status;post_user_90229869376;90229869376_10154610514704377;https://www.facebook.com/90229869376/posts/10154610514704377;A pat on the bk for Kayleigh in the cafe at Bridgwater. What a lovely  kind and funny lady. Cheered me up even though I nearly destroyed one of her cake covers!;;;;;2016-03-07T16:48:31+0000;1457369311;2016-03-07 17:48:31;13;12;13;1;26;12;6;6;6;0;13;0;0;0;0;0;0
status;post_user_90229869376;90229869376_10154610411384377;https://www.facebook.com/90229869376/posts/10154610411384377;More and more Basics products are disappearing from the shelves (in the last year or so  3 of the regular items I was buying are no longer in store) and there seem to be very little in the fresh meat section these days with the Basic tag on it.  Is Sainsburys planning on stopping the range?  There is currently one 1 Basics product left that I buy regularly.;;;;;2016-03-07T15:56:40+0000;1457366200;2016-03-07 16:56:40;0;5;0;0;5;5;1;4;0;0;0;0;0;0;0;0;0
status;post_user_90229869376;90229869376_10154610392474377;https://www.facebook.com/90229869376/posts/10154610392474377;Weeks ago was told lies by person on phone who promised send 14 school vouchers as online customers for some reason weren t getting them.   Vouchers didn t arrive-she lied as she KNEW she couldn t send them evidentLy!   Today been told another load nonsense that she was wrong and knew couldn t ever send them and I m possibly lying so will need PROVE we are owed vouchers by sending screen shots of ever order .   Appalling Sainsburys-I think its time senior Management wake up as to what your staff are saying!;;;;;2016-03-07T15:43:53+0000;1457365433;2016-03-07 16:43:53;0;4;0;0;4;4;3;1;0;0;0;0;0;0;0;0;0
status;post_user_90229869376;90229869376_10154610369134377;https://www.facebook.com/90229869376/posts/10154610369134377;A big thank you to the lovely ladies that delivered our shopping in Brighton on Friday afternoon. We got stuck in traffic and were running quite late by the time we got there but they kindly waited for us to arrive! Much appreciated after a stressful journey! 👍🏻;;;;;2016-03-07T15:29:42+0000;1457364582;2016-03-07 16:29:42;8;2;8;1;11;2;1;1;1;0;8;0;0;0;0;0;0
status;post_user_90229869376;90229869376_10154610203779377;https://www.facebook.com/90229869376/posts/10154610203779377;Really disappointed that my local Sainsbury s has opted to change the dairy free chocolate they stock. Not only is the alternative £1 more expensive (because £1.50 isn t enough for some chocolate)  but it is disgusting. Do your buyers genuinely taste this stuff before they make decisions like this or is it simply so they can charge the extra £1 for 15g of chocolate? As the sleep deprived mother of a five month old baby with a dairy allergy I hope you can understand why I am so upset - I need chocolate!!;;;;;2016-03-07T14:43:11+0000;1457361791;2016-03-07 15:43:11;5;5;5;1;11;5;1;4;1;0;5;0;0;0;0;0;0
status;post_user_90229869376;90229869376_10154610187664377;https://www.facebook.com/90229869376/posts/10154610187664377;Can you tell me when I look at online delivery costs for certain slots it says £1 or £2 yet when I go to book deliver shoots up to £6.95??;;;;;2016-03-07T14:31:58+0000;1457361118;2016-03-07 15:31:58;0;4;0;0;4;4;2;2;0;0;0;0;0;0;0;0;0
status;post_user_90229869376;90229869376_10154610177414377;https://www.facebook.com/90229869376/posts/10154610177414377;Just a suggestion - why don t large supermarkets stop putting the parent and child spaces by the door of the store so people stop abusing them! Parents dont use these spaces because we are lazy but to allow space for us to take children and babies in car seats out of the car easily and without damaging other vehicles. If the spaces were at the other end of the car park we might actually get to use them instead of all the lazy ********* taking them first! Oh and if you have a car seat in your car but no child with you  that shouldn t give you the right to use them either. Rant over.....;;;;;2016-03-07T14:24:10+0000;1457360650;2016-03-07 15:24:10;21;22;21;0;43;22;10;12;15;0;20;0;0;0;0;0;0
status;post_user_90229869376;90229869376_10154610124199377;https://www.facebook.com/90229869376/posts/10154610124199377;Is it true sainsburys are not continuing with the mega store and petrol station in Herne bay?;;;;;2016-03-07T13:57:18+0000;1457359038;2016-03-07 14:57:18;0;8;0;0;8;8;5;3;1;0;0;0;0;0;0;0;0
status;post_user_90229869376;90229869376_10154610056409377;https://www.facebook.com/90229869376/posts/10154610056409377;Disappointed that Sainsbury has pulled the plug on the new store in Herne Bay.😣;;;;;2016-03-07T13:23:38+0000;1457357018;2016-03-07 14:23:38;0;4;0;3;7;4;4;0;3;0;0;0;0;0;0;0;0
status;post_user_90229869376;90229869376_10154609992589377;https://www.facebook.com/90229869376/posts/10154609992589377;Second PlayStation controller that I ve bought for my son from your store near alder hey children s hospital since his heart surgery on 1st Feb and it s broken again  No receipt so highly unlikely they ll give me a refund already went in with a faulty one a few weeks ago and ended up having to purchase another  As if I haven t got enough stress as it is;;;;;2016-03-07T12:48:19+0000;1457354899;2016-03-07 13:48:19;0;5;0;0;5;5;1;4;1;0;0;0;0;0;0;0;0
status;post_user_90229869376;90229869376_10154609959294377;https://www.facebook.com/90229869376/posts/10154609959294377;My mum and sister were n your store in Falmouth today. While using the self service checkout they had an issue scanning a money off coupon. A man whoworks there came over to assist. He gave them really bad attitude and snapped ho he d watched them doing wrong. When they pointed out they had pressed the correct buttons hesaid he didn t see that. The coupon wouldn t scan for him either. He s excuse for the attitude he gave them was he s not good at customer service. They went to the customer service desk after as they felt the matter needed highlighting. Specially as he works with customers yet can t do customer service onlytoget oh ok. No apology for the way they were treated.;;;;;2016-03-07T12:26:27+0000;1457353587;2016-03-07 13:26:27;0;1;0;0;1;1;1;0;0;0;0;0;0;0;0;0;0
status;post_user_90229869376;90229869376_10154609901314377;https://www.facebook.com/90229869376/posts/10154609901314377;hi  will u be doing the 1kg anchor spreadable any time soon?;;;;;2016-03-07T11:51:18+0000;1457351478;2016-03-07 12:51:18;0;6;0;0;6;6;1;5;0;0;0;0;0;0;0;0;0
status;post_user_90229869376;90229869376_10154609812484377;https://www.facebook.com/90229869376/posts/10154609812484377;Complaint: Thanks Sainsbury s for messing up my on-line delivery order on Mothers Day and not delivery my Mother her gift I ordered for her   as I am oversea s.  Very upset and disappointed.;;;;;2016-03-07T10:43:52+0000;1457347432;2016-03-07 11:43:52;0;1;0;0;1;1;1;0;0;0;0;0;0;0;0;0;0
status;post_user_90229869376;90229869376_10154609812179377;https://www.facebook.com/90229869376/posts/10154609812179377;Have you stopped selling Oscar Mayer bacon?;;;;;2016-03-07T10:43:37+0000;1457347417;2016-03-07 11:43:37;0;8;0;0;8;8;2;6;0;0;0;0;0;0;0;0;0
status;post_user_90229869376;90229869376_10154609711804377;https://www.facebook.com/90229869376/posts/10154609711804377;Hi   I went to sainsburys Boscombe   was shopping and noticed security guard following me   I continued shopping when going to till   guard followed and waited at exit   as I paid   I told cashier I found it offensive and to tell guard after I had left   I left store and as I got on motorbike guard was at my side  you got a problem?  He says   I get off bike and say yes  he gets angry   then shoves me backwards and shouts come on then   he wanted a fight  I have reported matter   to sainsburys   who have said its been felt with by security firm   funny that as I ve heard nothing   I have a fused spine and the jolt I recieved has hurt my back again   I have been shopping at Boscombe store for 17 years and I m disgusted at what happened   and how they are not dealing with this situation;;;;;2016-03-07T09:36:37+0000;1457343397;2016-03-07 10:36:37;1;22;1;0;23;22;4;18;0;0;1;0;0;0;0;0;0
status;post_user_90229869376;90229869376_10154609711104377;https://www.facebook.com/90229869376/posts/10154609711104377;Just had the worst online shopping experience 😕 & its a shame cause i always shop at Sainsbury s but decided to try their online delivery. I missed my delivery slot last night between 9-10  got your slip saying call within 24hrs which I did within less than an hr. Called again this morning to find out when the delivery can most likely happen but only to be told its been cancelled😳Well guess you did not want my £80. Sucks cause I like Sainsbury s but sorry never again😕;;;;;2016-03-07T09:35:49+0000;1457343349;2016-03-07 10:35:49;0;4;0;0;4;4;3;1;0;0;0;0;0;0;0;0;0
status;post_user_90229869376;90229869376_10154609614904377;https://www.facebook.com/90229869376/posts/10154609614904377;Your customer service is appalling.;;;;;2016-03-07T08:18:51+0000;1457338731;2016-03-07 09:18:51;1;6;1;0;7;6;2;4;0;0;1;0;0;0;0;0;0
status;post_user_90229869376;90229869376_10154609594944377;https://www.facebook.com/90229869376/posts/10154609594944377;U.K. product alert -- posting this just because it s so utterly outrageous: Sainsbury s Fabric Conditioner  Gentle  contains FOUR isothiazolinones.  contains amongst Other Ingredients 5% - 15% Cationic Surfactant. Also contains Methylchloroisothiazolinone  Methylisothiazolinone  Benzisothiazolinone  Octylisothiazolinone  Perfume.   Any comments please Sainsburys?! this is outrageous..;;;;;2016-03-07T07:55:30+0000;1457337330;2016-03-07 08:55:30;0;5;0;0;5;5;4;1;5;0;0;0;0;0;0;0;0
status;post_user_90229869376;90229869376_10154609592704377;https://www.facebook.com/90229869376/posts/10154609592704377;I just wanted to say what a fantastic service I received yesterday. Me and my husband popped into sainsburys in Lincoln to pick up a few bits with our two small children. Our 3 year old struggles in supermarkets  so sitting in the main bit of the trolley  while our daughter was in the baby seat  he had a melt down as soon as we got in the door. We reached the fridge section before his meltdown became too much and we couldn t calm him down. we were about to turn and leave when a colleague (sally) who was putting reduced stickers on some meat came over and gave him some blank stickers. He instantly calmed down and started playing with the stickers. She then presented him with a little toy that has lights and sounds and from that second we didn t hear any sound from him  he sat contented in the trolley while me and my husband could get some shopping. Her small gesture of taking some time out of her work to offer comfort to our son meant we could do our shopping and have a nice experience. It really meant a lot to us. Most people stare and make remarks  she was so understanding  it was lovely. I will be doing my shopping in sainsburys from now on! We did stop and tell the manager about our excellent service but I wanted to reiterate on here so she really gets the recognition she deserves.;;;;;2016-03-07T07:52:51+0000;1457337171;2016-03-07 08:52:51;454;24;459;9;492;24;20;4;30;0;448;5;0;0;0;0;0
status;post_user_90229869376;90229869376_10154609514379377;https://www.facebook.com/90229869376/posts/10154609514379377;What has happened to the quality of your flowers?  Two days in and mine have wilted. I ve sent the photos.  You ve lost a customer.;;;;;2016-03-07T06:27:43+0000;1457332063;2016-03-07 07:27:43;1;9;1;0;10;9;2;7;3;0;1;0;0;0;0;0;0
status;post_user_90229869376;90229869376_10154608545279377;https://www.facebook.com/90229869376/posts/10154608545279377;Wrexham Sainsburys s you need to sort out the rat infestation problem pretty quick before you have no customers!  Today they were just sitting on the pavement near the petrol station - I certainly won t be visiting again any time soon!;;;;;2016-03-06T21:35:01+0000;1457300101;2016-03-06 22:35:01;0;8;0;0;8;8;3;5;2;0;0;0;0;0;0;0;0
status;post_user_90229869376;90229869376_10154608505054377;https://www.facebook.com/90229869376/posts/10154608505054377;Can you tell me if there is a supplier problem with Bourbon biscuits?prestwick store hasn t had any in weeks have had a few people complain been none;;;;;2016-03-06T21:14:59+0000;1457298899;2016-03-06 22:14:59;0;3;0;0;3;3;3;0;0;0;0;0;0;0;0;0;0
status;post_user_90229869376;90229869376_10154608407389377;https://www.facebook.com/90229869376/posts/10154608407389377;You only had 5 jobs!!!! So ordered mum s mothers day present during the week(so ample notice). Deliberated longly over choices and chose a scented bunch of flowers (substitute given)  a lamb casserole (substitute given)  orchard tarts (substitute given)  wine and after dinner chocolates (correct). Thinking maybe for next year you could do a  random  option to save us thinking what our loved ones would actually like.;;;;;2016-03-06T20:24:57+0000;1457295897;2016-03-06 21:24:57;0;8;0;0;8;8;1;7;0;0;0;0;0;0;0;0;0
status;post_user_90229869376;90229869376_10154608321219377;https://www.facebook.com/90229869376/posts/10154608321219377;Brand match Voucher not working. Have sent a message. Please respond.;;;;;2016-03-06T19:52:48+0000;1457293968;2016-03-06 20:52:48;0;0;0;0;0;0;0;0;0;0;0;0;0;0;0;0;0
status;post_user_90229869376;90229869376_10154608220599377;https://www.facebook.com/90229869376/posts/10154608220599377;So  following your suggestion  I put some jam in my panakes... My Mam is god damn furious that I didn t send a card. Thanks for that.  My pancakes were pretty good mind.;;;;;2016-03-06T18:58:14+0000;1457290694;2016-03-06 19:58:14;4;4;5;0;9;4;4;0;5;0;4;0;0;1;0;0;0
status;post_user_90229869376;90229869376_10154608158454377;https://www.facebook.com/90229869376/posts/10154608158454377;Please can you tell me why for the past 2 weeks Sixfields Northampton shop has not had any Linda Mccartney 1/4 pounder burgers in  Finally got them in after christmas and now disappeared again. Thanks;;;;;2016-03-06T18:31:34+0000;1457289094;2016-03-06 19:31:34;0;12;0;0;12;12;4;8;0;0;0;0;0;0;0;0;0
status;post_user_90229869376;90229869376_10154608130294377;https://www.facebook.com/90229869376/posts/10154608130294377;I have some pans from your range  cooks collection  we haven t had them all that long as they were a gift  the black on the inside of our large pan has started coming away and the copper(?) bottom of our smallest pan (out of a 3 set) has started coming away... Can we take them back and return and replace  I am pretty sure this shouldn t happen in such a short time  many thanks;;;;;2016-03-06T18:20:30+0000;1457288430;2016-03-06 19:20:30;0;6;0;0;6;6;1;5;1;0;0;0;0;0;0;0;0
status;post_user_90229869376;90229869376_10154608126699377;https://www.facebook.com/90229869376/posts/10154608126699377;Recently purchased a visa gift card from one of your store vanilla s as a gift  tried to spend it in a shop and it has been declined! The website on the back of the card to  check your balance  does not work! Are these a con?!;;;;;2016-03-06T18:18:54+0000;1457288334;2016-03-06 19:18:54;0;2;0;0;2;2;2;0;0;0;0;0;0;0;0;0;0
status;post_user_90229869376;90229869376_10154608086929377;https://www.facebook.com/90229869376/posts/10154608086929377;Really annoyed that sainsburys did not deliver today  apparently our order wasn t sent through to the store.  We had ordered a weeks food shop - no lunch box items for tomorrow or meals for the week. Really unhelpful with 3 children and husband working away all week and I am work.  We have been unable to have our mothers day meal today as planned and had to go out to eat! I have tried emailing you on your website but that doesn t seem to be working either.;;;;;2016-03-06T18:00:50+0000;1457287250;2016-03-06 19:00:50;0;3;0;0;3;3;3;0;0;0;0;0;0;0;0;0;0
status;post_user_90229869376;90229869376_10154607989244377;https://www.facebook.com/90229869376/posts/10154607989244377;Thank you Sainsbury s for ruining my day.  My order due between 2-3 pm this afternoon cancelled as your computer did not work over night.  How did I fnd out I had to ring you at 3.30 pm when nothing delivered.  Nothing on here  nothing on your website no text phone call or email.  Not good enough.;;;;;2016-03-06T17:10:31+0000;1457284231;2016-03-06 18:10:31;0;5;0;0;5;5;3;2;0;0;0;0;0;0;0;0;0
status;post_user_90229869376;90229869376_10154607608124377;https://www.facebook.com/90229869376/posts/10154607608124377;Bought some glittered roses from sainsbury in dog kennel hill yesterday for mother in law very disappointed as overnight the heads have all dropped over.it says 5 days guaranteed freshness  well that isn t the case.very unhappy and disappointed;;;;;2016-03-06T13:51:46+0000;1457272306;2016-03-06 14:51:46;0;3;0;0;3;3;1;2;0;0;0;0;0;0;0;0;0
status;post_user_90229869376;90229869376_10154607578374377;https://www.facebook.com/90229869376/posts/10154607578374377;Click & collect shopping - 41 items ordered packed into 21 bags  many  with just one small item in. Not really following the spirit of using less bags Sainsbury s. Yes  you can collect shopping without bags but when the collection point is in the middle of a car park and it is tipping down with rain that really isn t practical. Please use less bags.;;;;;2016-03-06T13:35:30+0000;1457271330;2016-03-06 14:35:30;1;3;1;0;4;3;1;2;0;0;1;0;0;0;0;0;0
status;post_user_90229869376;90229869376_10154607514879377;https://www.facebook.com/90229869376/posts/10154607514879377;Just got off the phone to sainsburys chasing the whereabouts of my 11am-12pm grocery delivery. Advised that an  admin error  means store never got my order. No phone call from sainsburys advise me. Serious inconvenience on today of all days #mothersdayfail;;;;;2016-03-06T12:51:29+0000;1457268689;2016-03-06 13:51:29;0;4;0;0;4;4;3;1;0;0;0;0;0;0;0;0;0
status;post_user_90229869376;90229869376_10154607494664377;https://www.facebook.com/90229869376/posts/10154607494664377;I ve received some really amazing customer service from Sainsbury s in the last couple of weeks. Well done to your customer service team 😀;;;;;2016-03-06T12:36:13+0000;1457267773;2016-03-06 13:36:13;1;1;1;0;2;1;1;0;0;0;1;0;0;0;0;0;0
